id,passage,claim,verdict,source_quote,source_excerpt_preview,approve
l3-s2_c3f07389d37188c87ec5cc284445e9fbc9971753-sup-0,"The paper states that results: The systematic search of the literature generated 253 studies (Jatau et al., 2021).",Results: The systematic search of the literature generated 253 studies.,supported,Results: The systematic search of the literature generated 253 studies.,"...racy, coverage, objectively, date, significance). Results: The systematic search of the literature generated 253 studies. Nine articles were obtained from other sources. After the selection process, 23 eligible studies were includ...",
l3-s2_4220c9b1acb244521542c0542834e04f160d80ad-sup-0,"Researchers reported that rESULTS: Using the CSTD compared to the standard preparation techniques, a significant reduction in levels of contamination was observed for all drugs (cyclophosphamide: p < 0.0001; ifosfamide: p < 0.001; 5-fluorouracil: p < 0.01) (Sessink et al., 2011).","RESULTS: Using the CSTD compared to the standard preparation techniques, a significant reduction in levels of contamination was observed for all drugs (cyclophosphamide: p < 0.0001; ifosfamide: p < 0.",supported,"RESULTS: Using the CSTD compared to the standard preparation techniques, a significant reduction in levels of contamination was observed for all drugs (cyclophosphamide: p < 0.0001; ifosfamide: p < 0.001; 5-fluorouracil: p < 0.01).","...chniques and evaluated with the Signed Rank Test. RESULTS: Using the CSTD compared to the standard preparation techniques, a significant reduction in levels of contamination was observed for all drugs (cyclophosphamide: p < 0.0001...",
l3-s2_f817d35847c52ed96a9a67cc509fd43275fa80b1-nisthin-3,"the intervention reduced five-year mortality by 60% in all subgroups (Tjia et al., 2014).",the intervention reduced five-year mortality by 60% in all subgroups,not_in_source,,"DESIGN, SETTING, AND PARTICIPANTS Cross-sectional study of medication use by nursing home residents with advanced dementia using a nationwide long-term care pharmacy database linke...",
l3-s2_2d2659654d270ecaf9fc2df292713ceb58ba0337-weak-2,"Prior findings indicate no significant effects be found for the impact of base services on performance and servitization for both high and low degrees of co-creation (Ruiz-Alba et al., 2019).",No significant effects be found for the impact of base services on performance and servitization for both high and low degrees of co-creation.,weak,No significant effects could be found for the impact of base services on performance and servitization for both high and low degrees of co-creation.,...non-significant with a low degree of co-creation. No significant effects could be found for the impact of base services on performance and servitization for both high and low degrees of co-creation. Findings show an impact of adva...,
l3-s2_8226f2f54d9d9883285078906f2b5aef519523b7-nisthin-3,"gene therapy restored full organ function in every treated patient (Martinez et al., 2013).",gene therapy restored full organ function in every treated patient,not_in_source,,"PURPOSE: The development, implementation, and initial results of a pharmacist-managed heart failure (HF) medication titration clinic are described.",
l3-oa_w2513506562-weak-2,"Prior findings indicate vSEARCH then performs optimal global sequence alignment of the query against target sequences, using full dynamic programming instead of the seed-and-extend heuristic used by USEARCH (Rognes et al., 2016).","VSEARCH then performs optimal global sequence alignment of the query against target sequences, using full dynamic programming instead of the seed-and-extend heuristic used by USEARCH.",weak,"VSEARCH then performs optimal global sequence alignment of the query against potential target sequences, using full dynamic programming instead of the seed-and-extend heuristic used by USEARCH.","..., a similar strategy is probably used in USEARCH. VSEARCH then performs optimal global sequence alignment of the query against potential target sequences, using full dynamic programming instead of the seed-and-extend heuristic use...",
l3-s2_cb840db6d21bfe5a59117d460e9ae9a6e5ab1fff-sup-0,"Prior findings indicate rESULTS A total of 187 patients were included, 65% were male, and the mean (SD) age was 67 (13) years (Stømer et al., 2020).","RESULTS A total of 187 patients were included, 65% were male, and the mean (SD) age was 67 (13) years.",supported,"RESULTS A total of 187 patients were included, 65% were male, and the mean (SD) age was 67 (13) years.","...ated with QoL and adherence to long-term therapy. RESULTS A total of 187 patients were included, 65% were male, and the mean (SD) age was 67 (13) years. The high-level HL group (N = 52) had significantly better QoL than patients i...",
l3-s2_852abeceb4230de2d27c152c2d3ec780a9ce85da-weak-2,"Researchers reported that coumarin derivatives be obtained from different starting materials with various methods but with big differences in yield (Lončarić et al., 2020).",Coumarin derivatives be obtained from different starting materials with various methods but with big differences in yield.,weak,Coumarin derivatives could be obtained from different starting materials with various methods but with big differences in yield.,"...oped in order to synthesize coumarin derivatives. Coumarin derivatives could be obtained from different starting materials with various methods but with big differences in yield. This review summarized various methods, techniques ...",
l3-s2_dc45c17314a8b1750b7fec7759ff3e564ca7893c-sup-0,"Researchers reported that in six studies, the authors show that social crowdedness not only leads to greater accessibility of safety-related constructs but also results in greater preference for safety-oriented options (e.g., preferring to visit a pharmacy to a convenience store), being more receptive to prevention- (r","In six studies, the authors show that social crowdedness not only leads to greater accessibility of safety-related constructs but also results in greater preference for safety-oriented options (e.g., ",supported,"In six studies, the authors show that social crowdedness not only leads to greater accessibility of safety-related constructs but also results in greater preference for safety-oriented options (e.g., preferring to visit a pharmacy to a convenience store), being more receptive to prevention- (rather than promotion-) fra","...ironment affect people's choices and preferences? In six studies, the authors show that social crowdedness not only leads to greater accessibility of safety-related constructs but also results in greater preference for safety-orie...",
l3-oa_w4281564584-sup-0,"Prior findings indicate the Coding Manual fourth edition is reformatted to 15 chapters and divided into three parts, as opposed to six chapters in the third edition (Lungu, 2022).","The Coding Manual fourth edition is reformatted to 15 chapters and divided into three parts, as opposed to six chapters in the third edition.",supported,"The Coding Manual fourth edition is reformatted to 15 chapters and divided into three parts, as opposed to six chapters in the third edition.","The Coding Manual fourth edition is reformatted to 15 chapters and divided into three parts, as opposed to six chapters in the third edition. This provides readers with more straig...",
l3-s2_fd80079456d665e463e6f374d33caccad13cc38f-sup-0,"Prior findings indicate in addition, residents of LTCFs might be at increased risk for severe outcomes because of their advanced age or the presence of underlying chronic medical conditions (4) (Gharpure et al., 2021).","In addition, residents of LTCFs might be at increased risk for severe outcomes because of their advanced age or the presence of underlying chronic medical conditions (4).",supported,"In addition, residents of LTCFs might be at increased risk for severe outcomes because of their advanced age or the presence of underlying chronic medical conditions (4).","...en documented settings of COVID-19 outbreaks (3). In addition, residents of LTCFs might be at increased risk for severe outcomes because of their advanced age or the presence of underlying chronic medical conditions (4). As a resu...",
l3-oa_w2951464304-sup-0,"Prior findings indicate uFBoot2 is 778 times (median) faster than SBS and 8.4 times (median) faster than RAxML rapid bootstrap on tested data sets (Hoang et al., 2017).",UFBoot2 is 778 times (median) faster than SBS and 8.4 times (median) faster than RAxML rapid bootstrap on tested data sets.,supported,UFBoot2 is 778 times (median) faster than SBS and 8.4 times (median) faster than RAxML rapid bootstrap on tested data sets.,...trap resampling strategies for phylogenomic data. UFBoot2 is 778 times (median) faster than SBS and 8.4 times (median) faster than RAxML rapid bootstrap on tested data sets. UFBoot2 is implemented in the IQ-TREE software package v...,
l3-s2_9363d8bd3375144dc7255edd25f4f04a215014e8-con-1,"The paper states that of prescriptions for adolescents and young adults, 17% had daily dosages of ≥50 morphine milligram equivalents; 4.6% had benzodiazepine overlap (Chua et al., 2021).","Of prescriptions for adolescents and young adults, 17% had daily dosages of ≥50 morphine milligram equivalents; 4.6% had benzodiazepine overlap.",contradicted,"Of prescriptions for adolescents and young adults, 11.5% had daily dosages of ≥50 morphine milligram equivalents; 4.6% had benzodiazepine overlap.","...ren, 8.4% and 7.7% were for codeine and tramadol. Of prescriptions for adolescents and young adults, 11.5% had daily dosages of ≥50 morphine milligram equivalents; 4.6% had benzodiazepine overlap. Overall, 45.6% of prescriptions w...",
l3-s2_aa66999e407458033f45b493a962c9fee0e06836-sup-0,"The paper states that children with ADHD had 9.9 times more outpatient mental health visits (1.35/year vs 0.14/year), 3.4 times more pharmacy fills (11.25/year vs 3.30/year), and 1.6 times more primary care visits (3.84/year vs 2.36/year) than children without ADHD (Guevara et al., 2001).","Children with ADHD had 9.9 times more outpatient mental health visits (1.35/year vs 0.14/year), 3.4 times more pharmacy fills (11.25/year vs 3.30/year), and 1.6 times more primary care visits (3.84/ye",supported,"Children with ADHD had 9.9 times more outpatient mental health visits (1.35/year vs 0.14/year), 3.4 times more pharmacy fills (11.25/year vs 3.30/year), and 1.6 times more primary care visits (3.84/year vs 2.36/year) than children without ADHD.","...costs ($1465 vs $690) than children without ADHD. Children with ADHD had 9.9 times more outpatient mental health visits (1.35/year vs 0.14/year), 3.4 times more pharmacy fills (11.25/year vs 3.30/year), and 1.6 times more primary ...",
l3-s2_1ceea5d8b6b99c31fd2598f702b983232673c741-weak-2,"The paper states that we also discuss other measures that can be implemented (Vandoros & Stargardt, 2013).",We also discuss other measures that can be implemented.,weak,We also discuss other potential measures that can be implemented.,"...harmaceutical market as a response to the crisis. We also discuss other potential measures that can be implemented. The recommendations are relevant to European countries facing debt crises, but also to any other country, as impro...",
l3-oa_w1999167944-sup-0,"Here, we revise and update the planetary boundary framework, with a focus on the underpinning biophysical science, based on targeted input from expert research communities and on more general scientific advances over the past 5 years (Steffen et al., 2015).","Here, we revise and update the planetary boundary framework, with a focus on the underpinning biophysical science, based on targeted input from expert research communities and on more general scientif",supported,"Here, we revise and update the planetary boundary framework, with a focus on the underpinning biophysical science, based on targeted input from expert research communities and on more general scientific advances over the past 5 years.","... that regulate the stability of the Earth system. Here, we revise and update the planetary boundary framework, with a focus on the underpinning biophysical science, based on targeted input from expert research communities and on m...",
l3-s2_ee6464bcd058ad406c4e96909878255334644e70-con-1,"Immediately marized coming war on terrorism as [their] theology versus [our] technology, suicide bomber against nuclear power.2 His statement missed point: is American theology (Dinerstein, 2006).","Immediately marized coming war on terrorism as [their] theology versus [our] technology, suicide bomber against nuclear power.2 His statement missed point: is American theology.",contradicted,"Immediately marized coming war on terrorism as [their] theology versus [our] technology, suicide bomber against nuclear power.1 His statement missed point: is American theology.","Immediately marized coming war on terrorism as [their] theology versus [our] technology, suicide bomber against nuclear power.1 His statement missed point: is American theology. Fo...",
l3-s2_7215cb99c85327f309afe2038d60ac70fc37fa4f-ins-5,"Prior findings indicate rESULTS We describe five promising community pharmacist-led intervention strategies: Collaborative Practice Agreements (CPAs), point-of-care (POC) testing, patient consultations, academic detailing and serving as an advocate for patients and other healthcare providers CONCLUSIONS: This review hi","RESULTS We describe five promising community pharmacist-led intervention strategies: Collaborative Practice Agreements (CPAs), point-of-care (POC) testing, patient consultations, academic detailing an",insufficient_evidence,,"BACKGROUND Antibiotic resistance is one of the world's most pressing public health problems, resulting in over 23,000 deaths per year. OBJECTIVE The purpose of this paper is to des...",
l3-s2_2d2659654d270ecaf9fc2df292713ceb58ba0337-sup-0,"Findings Main findings suggest that when the level of co-creation of the design of services is high, there are significant effects of servitization on firm performance (Ruiz-Alba et al., 2019).","Findings Main findings suggest that when the level of co-creation of the design of services is high, there are significant effects of servitization on firm performance.",supported,"Findings Main findings suggest that when the level of co-creation of the design of services is high, there are significant effects of servitization on firm performance.","...ere analysed using structural equation modelling. Findings Main findings suggest that when the level of co-creation of the design of services is high, there are significant effects of servitization on firm performance. The moderat...",
l3-s2_d001d7f5bd05edd70496f433d17774433e140907-sup-0,"Researchers reported that pRINCIPAL FINDINGS Opioid use decreased 23% (31.5-6.5) to 38% (60.3-14.4) among WH users depending on level of WH use compared to a secular 11% (12.0-9.9) decrease among Veterans using Conventional Care (Bokhour et al., 2022).",PRINCIPAL FINDINGS Opioid use decreased 23% (31.5-6.5) to 38% (60.3-14.4) among WH users depending on level of WH use compared to a secular 11% (12.0-9.9) decrease among Veterans using Conventional Ca,supported,PRINCIPAL FINDINGS Opioid use decreased 23% (31.5-6.5) to 38% (60.3-14.4) among WH users depending on level of WH use compared to a secular 11% (12.0-9.9) decrease among Veterans using Conventional Care.,...nd 6 months to measure patient-reported outcomes. PRINCIPAL FINDINGS Opioid use decreased 23% (31.5-6.5) to 38% (60.3-14.4) among WH users depending on level of WH use compared to a secular 11% (12.0-9.9) decrease among Veterans u...,
l3-s2_38223e4e03926656010a130b9d1f77ffe1800611-sup-0,"No tetracycline-like staining was observed in any of the exposed children's teeth (0/58, 95% CI 0%-5%), and no significant difference in tooth shade (P=.20) or hypoplasia (P=1.0) was found between the 2 groups (Todd et al., 2015).","No tetracycline-like staining was observed in any of the exposed children's teeth (0/58, 95% CI 0%-5%), and no significant difference in tooth shade (P=.20) or hypoplasia (P=1.0) was found between the",supported,"No tetracycline-like staining was observed in any of the exposed children's teeth (0/58, 95% CI 0%-5%), and no significant difference in tooth shade (P=.20) or hypoplasia (P=1.0) was found between the 2 groups.","... 213 children who had never received doxycycline. No tetracycline-like staining was observed in any of the exposed children's teeth (0/58, 95% CI 0%-5%), and no significant difference in tooth shade (P=.20) or hypoplasia (P=1.0) w...",
l3-s2_f48edadc36ae47fa9ef967bd5fa5bbd899ecc608-sup-0,"Results: The response rate was 28.2% of the total sample, representing 63.8% of commercial members and 37.2% of Medicare members (Nair et al., 2011).","Results: The response rate was 28.2% of the total sample, representing 63.8% of commercial members and 37.2% of Medicare members.",supported,"Results: The response rate was 28.2% of the total sample, representing 63.8% of commercial members and 37.2% of Medicare members.","...uring the four-month period preceding the survey. Results: The response rate was 28.2% of the total sample, representing 63.8% of commercial members and 37.2% of Medicare members. Mean age was 63.4 years. Mean MPR was 61.0% for th...",
l3-s2_87231c0efd927d6b2aaefda66a402db4dfc582e9-sup-0,"In this work, results HIV+ waiting list candidates were more often young (&lt;50 years old: 62.7% versus 37.6%; P &lt;0.001), were more often men (75.2% versus 59.3%; P &lt;0.001), were more often black (73.6% versus 27.9%; P &lt;0.001), had longer time on dialysis (years: 2.5 versus 0.8; P &lt;0.001), were more often ","Results HIV+ waiting list candidates were more often young (&lt;50 years old: 62.7% versus 37.6%; P &lt;0.001), were more often men (75.2% versus 59.3%; P &lt;0.001), were more often black (73.6% vers",supported,"Results HIV+ waiting list candidates were more often young (&lt;50 years old: 62.7% versus 37.6%; P &lt;0.001), were more often men (75.2% versus 59.3%; P &lt;0.001), were more often black (73.6% versus 27.9%; P &lt;0.001), had longer time on dialysis (years: 2.5 versus 0.8; P &lt;0.001), were more often coinfected wit","...nd 72,297 HIV− kidney transplantation candidates. Results HIV+ waiting list candidates were more often young (&lt;50 years old: 62.7% versus 37.6%; P &lt;0.001), were more often men (75.2% versus 59.3%; P &lt;0.001), were more oft...",
l3-s2_dd7cd841e0ed29b312b9412636a0affca5565b44-weak-2,"In this work, despite these challenges, most students saw ChatGPT's to eventually replace traditional information-seeking methods (Hamid et al., 2023).","Despite these challenges, most students saw ChatGPT's to eventually replace traditional information-seeking methods.",weak,"Despite these challenges, most students saw ChatGPT's potential to eventually replace traditional information-seeking methods.","...n and questioned its reliability and credibility. Despite these challenges, most students saw ChatGPT's potential to eventually replace traditional information-seeking methods. CONCLUSIONS The study suggests that ChatGPT has the p...",
l3-s2_9e32c262e869e8fd757ba658fe618a4fad549d91-con-3,"PsO patients were more likely to have any inpatient admission (OR = 2), emergency room visit (OR = 1.3), and outpatient visit (OR = 29.3; all P < 0.01) (Feldman et al., 2015).","PsO patients were more likely to have any inpatient admission (OR = 2), emergency room visit (OR = 1.3), and outpatient visit (OR = 29.3; all P < 0.01).",contradicted,"PsO patients were more likely to have any inpatient admission (OR = 1.3), emergency room visit (OR = 1.3), and outpatient visit (OR = 29.3; all P < 0.01).","...scription medications (IRR = 2.1; both P < 0.01). PsO patients were more likely to have any inpatient admission (OR = 1.3), emergency room visit (OR = 1.3), and outpatient visit (OR = 29.3; all P < 0.01). PsO patients also incurre...",
l3-s2_020f7cb22db9a0ff3443d1a5f6db55d282c592b1-weak-2,"In this work, BACKGROUND: Accumulating evidence suggests that statins affect diseases other than cardiovascular disease, including cancer, and that these effects depend on the lipid solubility of specific statins (Ahern et al., 2011).","BACKGROUND: Accumulating evidence suggests that statins affect diseases other than cardiovascular disease, including cancer, and that these effects depend on the lipid solubility of specific statins.",weak,"BACKGROUND: Accumulating evidence suggests that statins affect diseases other than cardiovascular disease, including cancer, and that these effects may depend on the lipid solubility of specific statins.","BACKGROUND: Accumulating evidence suggests that statins affect diseases other than cardiovascular disease, including cancer, and that these effects may depend on the lipid solubili...",
l3-s2_cb9dc2c21e20dec32fe53f0a0e56dd2a4dcab97c-sup-0,"The paper states that occurrence of VTE was associated with increased mortality (transition hazard-ratio (THR): 3.09 [95%CI: 2.07-4.60] (Moik et al., 2020).",Occurrence of VTE was associated with increased mortality (transition hazard-ratio (THR): 3.09 [95%CI: 2.07-4.60].,supported,Occurrence of VTE was associated with increased mortality (transition hazard-ratio (THR): 3.09 [95%CI: 2.07-4.60].,...erval (CI): 8.2-18.5)] and 1.8% [95%CI: 0.7-3.6]. Occurrence of VTE was associated with increased mortality (transition hazard-ratio (THR): 3.09 [95%CI: 2.07-4.60]. History of VTE predicted VTE occurrence (subdistribution hazard r...,
l3-s2_0d3bd235ec371411b2043a06fc38ad25fb938c16-weak-2,"Prior findings indicate prospective evaluations of the interactions among champion attributes, context, and outcomes further elucidate how champions exert their effects (Bonawitz et al., 2020).","Prospective evaluations of the interactions among champion attributes, context, and outcomes further elucidate how champions exert their effects.",weak,"Prospective evaluations of the interactions among champion attributes, context, and outcomes may further elucidate how champions exert their effects.","...tributes to facilitate healthcare change efforts. Prospective evaluations of the interactions among champion attributes, context, and outcomes may further elucidate how champions exert their effects.",
l3-s2_25f0136d6122020f87926c8032981bc1842654ed-weak-2,"These findings and other analyses that PCAT predict critical thinking skills in pharmacy practice courses and clerkships (Allen & Bond, 2001).",These findings and other analyses that PCAT predict critical thinking skills in pharmacy practice courses and clerkships.,weak,These findings and other analyses suggest that PCAT may predict critical thinking skills in pharmacy practice courses and clerkships.,"....237, p<0.001) and CCTST (pc = 0.201, p < 0.001). These findings and other analyses suggest that PCAT may predict critical thinking skills in pharmacy practice courses and clerkships. Further study is needed to confirm this findin...",
l3-s2_9815aec96c36b29631a13e5d94026ed6eb2aa1be-sup-0,"Researchers reported that rESULTS: Compared with the standard dose of intravenous immunoglobulin (adults, 300 mg/kg of body weight every 4 weeks; children, 400 mg/kg every 4 weeks), high-dose therapy (adults, 600 mg/kg every 4 weeks; children, 800 mg/kg every 4 weeks) significantly reduced the number (3.5 vs (Eijkhout ","RESULTS: Compared with the standard dose of intravenous immunoglobulin (adults, 300 mg/kg of body weight every 4 weeks; children, 400 mg/kg every 4 weeks), high-dose therapy (adults, 600 mg/kg every 4",supported,"RESULTS: Compared with the standard dose of intravenous immunoglobulin (adults, 300 mg/kg of body weight every 4 weeks; children, 400 mg/kg every 4 weeks), high-dose therapy (adults, 600 mg/kg every 4 weeks; children, 800 mg/kg every 4 weeks) significantly reduced the number (3.5 vs.","...cts from the study medication were also recorded. RESULTS: Compared with the standard dose of intravenous immunoglobulin (adults, 300 mg/kg of body weight every 4 weeks; children, 400 mg/kg every 4 weeks), high-dose therapy (adult...",
l3-s2_a55865ba577752a383784eaae1c1985bd753454f-con-1,"Prior findings indicate DESIGN, SETTING, AND PATIENTS Retrospective cohort study of patients aged 57 years or older with diabetes mellitus and no preexisting record of OAG in a large US managed care network from January 1, 2001, through December 31, 2010 (Lin et al., 2015).","DESIGN, SETTING, AND PATIENTS Retrospective cohort study of patients aged 57 years or older with diabetes mellitus and no preexisting record of OAG in a large US managed care network from January 1, 2",contradicted,"DESIGN, SETTING, AND PATIENTS Retrospective cohort study of patients aged 40 years or older with diabetes mellitus and no preexisting record of OAG in a large US managed care network from January 1, 2001, through December 31, 2010.","...glaucoma (OAG) in persons with diabetes mellitus. DESIGN, SETTING, AND PATIENTS Retrospective cohort study of patients aged 40 years or older with diabetes mellitus and no preexisting record of OAG in a large US managed care netwo...",
l3-s2_eac62f867603e9ed75e6198c81ffd2361b135109-nis-3,"Prior findings indicate air pollution levels were unrelated to any respiratory outcomes (Lapane et al., 2010).",air pollution levels were unrelated to any respiratory outcomes,not_in_source,,Introduction Recent studies have demonstrated that e-prescribing takes longer than handwriting. Additional studies documenting the perceived efficiencies realized from e-prescribin...,
