id,passage,claim,verdict,source_quote,source_excerpt_preview,approve
l3-oa_w1663973292-sup-0,"The <i>Journal of Electronic Imaging</i> (JEI), copublished bimonthly with the Society for Imaging Science and Technology, publishes peer-reviewed papers that cover research and applications in all areas of electronic imaging science and technology (Nasrabadi, 2007).","The <i>Journal of Electronic Imaging</i> (JEI), copublished bimonthly with the Society for Imaging Science and Technology, publishes peer-reviewed papers that cover research and applications in all ar",supported,"The <i>Journal of Electronic Imaging</i> (JEI), copublished bimonthly with the Society for Imaging Science and Technology, publishes peer-reviewed papers that cover research and applications in all areas of electronic imaging science and technology.","The <i>Journal of Electronic Imaging</i> (JEI), copublished bimonthly with the Society for Imaging Science and Technology, publishes peer-reviewed papers that cover research and ap...",
l3-s2_38223e4e03926656010a130b9d1f77ffe1800611-con-1,"Prior findings indicate cONCLUSIONS This study failed to demonstrate dental staining, enamel hypoplasia, or tooth color differences among children who received short-term courses of doxycycline at <12 years of age (Todd et al., 2015).","CONCLUSIONS This study failed to demonstrate dental staining, enamel hypoplasia, or tooth color differences among children who received short-term courses of doxycycline at <12 years of age.",contradicted,"CONCLUSIONS This study failed to demonstrate dental staining, enamel hypoplasia, or tooth color differences among children who received short-term courses of doxycycline at <8 years of age.","...ypoplasia (P=1.0) was found between the 2 groups. CONCLUSIONS This study failed to demonstrate dental staining, enamel hypoplasia, or tooth color differences among children who received short-term courses of doxycycline at <8 year...",
l3-s2_89d54c43f601c1126861d6da750396bd946af266-sup-0,"The paper states that the number of publications on this topic testifies to the good results obtained in the studies (Gabrielsson et al., 2002).",The number of publications on this topic testifies to the good results obtained in the studies.,supported,The number of publications on this topic testifies to the good results obtained in the studies.,"...he combination of the two in multivariate design. The number of publications on this topic testifies to the good results obtained in the studies. Much of the published material highlights the usefulness of experimental design, wit...",
l3-oa_w2099111195-nis-2,"Researchers reported that air pollution levels were unrelated to any respiratory outcomes (Cover & Thomas, 2001).",air pollution levels were unrelated to any respiratory outcomes,not_in_source,,Preface to the Second Edition. Preface to the First Edition. Acknowledgments for the Second Edition. Acknowledgments for the First Edition. 1. Introduction and Preview. 1.1 Preview...,
l3-s2_5c1b871fbf40bc35156289502d59231921daaf7d-sanad-2,"The rate was 2.1% in the primary analysis (Horwitz et al., 2007).",The rate was 2.1% in the primary analysis,supported,"Relative to changes experienced by the nonteaching service, the rate of intensive care unit utilization decreased by 2.1% (95% CI, -3.3% to -0.7%; P = 0.002), the rate of discharge to home or rehabilitation facility versus elsewhere improved by 5.3% (CI, 2.6% to 7.6%; P < 0.001), and pharmacist interventions to prevent","Relative to changes experienced by the nonteaching service, the rate of intensive care unit utilization decreased by 2.1% (95% CI, -3.3% to -0.7%; P = 0.002), the rate of discharge...",
l3-oa_w2142678478-sup-0,"Researchers reported that cONCLUSION: The new BLAST command-line applications, compared to the current BLAST tools, demonstrate substantial speed improvements for long queries as well as chromosome length database sequences (Camacho et al., 2009).","CONCLUSION: The new BLAST command-line applications, compared to the current BLAST tools, demonstrate substantial speed improvements for long queries as well as chromosome length database sequences.",supported,"CONCLUSION: The new BLAST command-line applications, compared to the current BLAST tools, demonstrate substantial speed improvements for long queries as well as chromosome length database sequences.","...d to and downloaded from the NCBI BLAST web site. CONCLUSION: The new BLAST command-line applications, compared to the current BLAST tools, demonstrate substantial speed improvements for long queries as well as chromosome length d...",
l3-s2_d69f428aa19ae56545549aa1ee37c5a1ddb8b55a-weak-2,"The paper states that conclusion The available evidence suggests hyperosmolar therapy be helpful in reducing ICP elevations or cerebral edema in patients with SAH, TBI, AIS, ICH, and HE, although neurological outcomes do not to be affected (Cook et al., 2020).","Conclusion The available evidence suggests hyperosmolar therapy be helpful in reducing ICP elevations or cerebral edema in patients with SAH, TBI, AIS, ICH, and HE, although neurological outcomes do n",weak,"Conclusion The available evidence suggests hyperosmolar therapy may be helpful in reducing ICP elevations or cerebral edema in patients with SAH, TBI, AIS, ICH, and HE, although neurological outcomes do not appear to be affected.","...bacterial meningitis, and hepatic encephalopathy. Conclusion The available evidence suggests hyperosmolar therapy may be helpful in reducing ICP elevations or cerebral edema in patients with SAH, TBI, AIS, ICH, and HE, although ne...",
l3-s2_662ec060c984b3c234c6d0f3b52c7c24cde129de-ins-4,"In this work, rESULTS: At study completion, intervention patients more frequently received assessments of glycosolated hemoglobin (79% versus 67%; P=.01), LDL-C (69% versus 55%; P=.009), blood pressure (86% versus 79%; P=.08), microalbuminuria (40% versus 30%; P=.05), smoking status assessment (43% versus 31%; P=.02), ","RESULTS: At study completion, intervention patients more frequently received assessments of glycosolated hemoglobin (79% versus 67%; P=.01), LDL-C (69% versus 55%; P=.009), blood pressure (86% versus ",insufficient_evidence,,PURPOSE: To improve the care and outcomes of adult patients with type 2 diabetes by teaching interprofessional teams of learners the principles and practices of the Improving Chron...,
l3-s2_c11a2808e50373a2bba13c7f66e08f7c39286478-sup-0,"Researchers reported that results The final cohort included 113 618 patients after 203 920 stable baseline periods (Agnoli et al., 2021).",Results The final cohort included 113 618 patients after 203 920 stable baseline periods.,supported,Results The final cohort included 113 618 patients after 203 920 stable baseline periods.,"...ing (vs no tapering) and dose reduction velocity. Results The final cohort included 113 618 patients after 203 920 stable baseline periods. Among the patients who underwent dose tapering, 54.3% were women (vs 53.2% among those who...",
l3-s2_2b3a1d52fbd4e6f8d566f1df6fba42b70e1e286f-nis-3,"In this work, lunar cycle phase significantly predicted weekly stock index returns (Estellat et al., 2007).",lunar cycle phase significantly predicted weekly stock index returns,not_in_source,,"BACKGROUND: Computerised physician order entry offers a potential means of reducing prescribing errors, and can also increase the feasibility of pharmacy validation as a secondary ...",
l3-oa_w2143104968-weak-2,"In this work, various diagnostic criteria have been by different organizations over the past decade (Alberti et al., 2009).",Various diagnostic criteria have been by different organizations over the past decade.,weak,Various diagnostic criteria have been proposed by different organizations over the past decade.,"...ol), raised fasting glucose, and central obesity. Various diagnostic criteria have been proposed by different organizations over the past decade. Most recently, these have come from the International Diabetes Federation and the Am...",
l3-s2_e1e678b60e75e1f4195f68f653419a9fd2c8872d-con-1,"The paper states that a nanoemulsion is an emulsion with 29–200 nm droplet size (Tafti & Mosavian, 2013).",A nanoemulsion is an emulsion with 29–200 nm droplet size.,contradicted,A nanoemulsion is an emulsion with 20–200 nm droplet size.,...lsion (oil-in-water (O/W) or water-in-oil (W/O)). A nanoemulsion is an emulsion with 20–200 nm droplet size. The required energy to form a nanoemulsion can be obtained from a mechanical device (high-energy emulsification) or from ...,
l3-s2_0b8861e3dfd3d812da1e6ac99eff2ce1ce7ad18f-sup-0,"Results Codable data were extracted from 146 comparisons with 19,348 participants (Conn et al., 2016).","Results Codable data were extracted from 146 comparisons with 19,348 participants.",supported,"Results Codable data were extracted from 146 comparisons with 19,348 participants.","...e effect sizes for medication adherence outcomes. Results Codable data were extracted from 146 comparisons with 19,348 participants. The most common theories and models were social cognitive theory and motivational interviewing. T...",
l3-s2_03e59e7d65346717548fc51962ce022bd82701cc-nisthin-4,"the intervention reduced five-year mortality by 60% in all subgroups (Ginsburg et al., 2008).",the intervention reduced five-year mortality by 60% in all subgroups,not_in_source,,"This position paper concerns improving health care in the United States. Unlike previous highly focused policy papers by the American College of Physicians, this article takes a co...",
l3-oa_w3113178943-sup-0,"Prior findings indicate prevalent cases of total CVD nearly doubled from 271 million (95% uncertainty interval [UI]: 257 to 285 million) in 1990 to 523 million (95% UI: 497 to 550 million) in 2019, and the number of CVD deaths steadily increased from 12.1 million (95% UI:11.4 to 12.6 million) in 1990, reaching 18.6 mil","Prevalent cases of total CVD nearly doubled from 271 million (95% uncertainty interval [UI]: 257 to 285 million) in 1990 to 523 million (95% UI: 497 to 550 million) in 2019, and the number of CVD deat",supported,"Prevalent cases of total CVD nearly doubled from 271 million (95% uncertainty interval [UI]: 257 to 285 million) in 1990 to 523 million (95% UI: 497 to 550 million) in 2019, and the number of CVD deaths steadily increased from 12.1 million (95% UI:11.4 to 12.6 million) in 1990, reaching 18.6 million (95% UI: 17.1 to 19","... 204 countries and territories from 1990 to 2019. Prevalent cases of total CVD nearly doubled from 271 million (95% uncertainty interval [UI]: 257 to 285 million) in 1990 to 523 million (95% UI: 497 to 550 million) in 2019, and th...",
l3-s2_3624e38c8d52860962c03bfe6d53986b8e008752-con-1,"Prior findings indicate according to a survey of 8212 ever-married women 15-49 years in Sri Lanka, the island nation has relatively good immunization coverage, increasing contraceptive use, and declining fertility (Kent, 2000).","According to a survey of 8212 ever-married women 15-49 years in Sri Lanka, the island nation has relatively good immunization coverage, increasing contraceptive use, and declining fertility.",contradicted,"According to a survey of 5865 ever-married women 15-49 years in Sri Lanka, the island nation has relatively good immunization coverage, increasing contraceptive use, and declining fertility.","According to a survey of 5865 ever-married women 15-49 years in Sri Lanka, the island nation has relatively good immunization coverage, increasing contraceptive use, and declining ...",
l3-oa_w2159267296-sup-0,"In this work, several examples using a variety of different statistical models illustrate the breadth of the results (Hothorn et al., 2008).",Several examples using a variety of different statistical models illustrate the breadth of the results.,supported,Several examples using a variety of different statistical models illustrate the breadth of the results.,"...models, the Cox model, robust linear models, etc. Several examples using a variety of different statistical models illustrate the breadth of the results. For the analyses we use the R add-on package multcomp, which provides a conv...",
l3-s2_69ccda50a1bd8a49cf4aca426bb97779331b1cc7-nisthin-4,"air pollution levels were unrelated to any respiratory outcomes (Dineen-Griffin et al., 2020).",air pollution levels were unrelated to any respiratory outcomes,not_in_source,,"There is evidence that the Australian Government is embracing a more integrated approach to health, with implementation of initiatives like primary health networks (PHNs) and the G...",
l3-s2_07bab7d70266dbd41397c7d55e8b902ef977a474-sup-0,"Researchers reported that this pharmacoepidemiology study uses US pharmacy data to compare prescriptions for hydroxychloroquine/chloroquine and azithromycin in February to April 2020 vs 2019, and vs the top 10 most commonly prescribed drugs in the same year, including angiotensin-converting enzyme inhibitors and angiot","This pharmacoepidemiology study uses US pharmacy data to compare prescriptions for hydroxychloroquine/chloroquine and azithromycin in February to April 2020 vs 2019, and vs the top 10 most commonly pr",supported,"This pharmacoepidemiology study uses US pharmacy data to compare prescriptions for hydroxychloroquine/chloroquine and azithromycin in February to April 2020 vs 2019, and vs the top 10 most commonly prescribed drugs in the same year, including angiotensin-converting enzyme inhibitors and angiotensin receptor blockers.","This pharmacoepidemiology study uses US pharmacy data to compare prescriptions for hydroxychloroquine/chloroquine and azithromycin in February to April 2020 vs 2019, and vs the top...",
l3-oa_w2070227796-sup-0,"Researchers reported that these programs enable high-quality data analysis that is accessible to novices while still powerful enough to meet the demands of an expert practitioner (Ravel & Newville, 2005).",These programs enable high-quality data analysis that is accessible to novices while still powerful enough to meet the demands of an expert practitioner.,supported,These programs enable high-quality data analysis that is accessible to novices while still powerful enough to meet the demands of an expert practitioner.,...lities based on tables of atomic absorption data. These programs enable high-quality data analysis that is accessible to novices while still powerful enough to meet the demands of an expert practitioner. The programs run on all ma...,
l3-s2_998fdbb4f416eed8bbad8a29a2b2c369f24431ee-con-1,"The paper states that fifty patients had vaccination without monitoring of antibodies, 113 patients are planned to be vaccinated within the next month, and 257 patients (Marion et al., 2021).","Fifty patients had vaccination without monitoring of antibodies, 113 patients are planned to be vaccinated within the next month, and 257 patients",contradicted,"Fifty patients had vaccination without monitoring of antibodies, 80 patients are planned to be vaccinated within the next month, and 257 patients","... 8) and had anti–SARS-CoV-2 antibodies monitored. Fifty patients had vaccination without monitoring of antibodies, 80 patients are planned to be vaccinated within the next month, and 257 patients",
l3-s2_5e5fcd3c3f6e9b575dd8946fa32def3933fc4379-ins-5,"RESULTS: We identified 145 patients who met inclusion criteria (Rozet et al., 2014).",RESULTS: We identified 145 patients who met inclusion criteria.,insufficient_evidence,,BACKGROUND: Chronic postoperative pain occurs with an appreciable incidence after elective surgery. METHODS: We reviewed the medical and pharmacy records of veterans (18-50 years o...,
l3-s2_ddb7d3ec2ab7219a2bfd68ebeaf3fc84959e0e1d-sup-0,"The paper states that rESULTS: Of 302 articles identified, 108 involved pharmacists' interventions; 36 addressed diabetes (14 medical clinics, 11 community pharmacies, 7 ambulatory care clinics, 4 hospital wards, 1 physician's office, 1 prison, and 3 in both medical clinics and community pharmacies; 1 did not describe ","RESULTS: Of 302 articles identified, 108 involved pharmacists' interventions; 36 addressed diabetes (14 medical clinics, 11 community pharmacies, 7 ambulatory care clinics, 4 hospital wards, 1 physici",supported,"RESULTS: Of 302 articles identified, 108 involved pharmacists' interventions; 36 addressed diabetes (14 medical clinics, 11 community pharmacies, 7 ambulatory care clinics, 4 hospital wards, 1 physician's office, 1 prison, and 3 in both medical clinics and community pharmacies; 1 did not describe its practice site).","...-effects meta-analysis combined amenable results. RESULTS: Of 302 articles identified, 108 involved pharmacists' interventions; 36 addressed diabetes (14 medical clinics, 11 community pharmacies, 7 ambulatory care clinics, 4 hospi...",
l3-s2_84f3d331798c9eedc7be8e24b0a51ffd193ccea2-sup-0,"In this work, rESULTS: Panelists reached consensus agreement on 40 signals: 15 laboratory and medication combinations, 12 medication concentrations, 10 antidotes, and three Resident Assessment Protocols (RAPs) (Handler et al., 2008).","RESULTS: Panelists reached consensus agreement on 40 signals: 15 laboratory and medication combinations, 12 medication concentrations, 10 antidotes, and three Resident Assessment Protocols (RAPs).",supported,"RESULTS: Panelists reached consensus agreement on 40 signals: 15 laboratory and medication combinations, 12 medication concentrations, 10 antidotes, and three Resident Assessment Protocols (RAPs).","...icated by a lower-limit 95% CI of 4.0 or greater. RESULTS: Panelists reached consensus agreement on 40 signals: 15 laboratory and medication combinations, 12 medication concentrations, 10 antidotes, and three Resident Assessment P...",
l3-s2_fe24dad0f6adf6d5bc589fe89fb8b6535506eb8c-ins-5,"In this work, rESULTS: Of the 121 questionnaires disseminated, 76 (63%) were returned (Walker et al., 2004).","RESULTS: Of the 121 questionnaires disseminated, 76 (63%) were returned.",insufficient_evidence,,BACKGROUND: It is important to understand health professionals' attitudes and beliefs about practice and the barriers to achieving best practice. METHODS: A questionnaire survey wa...,
l3-oa_w2140190241-nis-1,"blockchain adoption cut administrative costs by half across hospitals (Han & Kamber, 2012).",blockchain adoption cut administrative costs by half across hospitals,not_in_source,,"Our ability to generate and collect data has been increasing rapidly. Not only are all of our business, scientific, and government transactions now computerized, but the widespread...",
l3-s2_2b3a1d52fbd4e6f8d566f1df6fba42b70e1e286f-sup-0,"Prior findings indicate rESULTS: About 399 (11%) prescription order lines, corresponding to 222 (52%) patients, required a pharmacy alert during the study period (Estellat et al., 2007).","RESULTS: About 399 (11%) prescription order lines, corresponding to 222 (52%) patients, required a pharmacy alert during the study period.",supported,"RESULTS: About 399 (11%) prescription order lines, corresponding to 222 (52%) patients, required a pharmacy alert during the study period.","...th the computerized physician order entry system. RESULTS: About 399 (11%) prescription order lines, corresponding to 222 (52%) patients, required a pharmacy alert during the study period. Among the 81 pharmacy alerts targeted to ...",
l3-s2_566e351cf3375809494ca35a34c1377274243b71-nis-3,"The paper states that the intervention reduced five-year mortality by 60% in all subgroups (Sono et al., 2023).",the intervention reduced five-year mortality by 60% in all subgroups,not_in_source,,"ABSTRACT Introduction Antimicrobial resistance (AMR) is a global concern. Currently, the greatest mortality due to AMR is in Africa. A key driver continues to be high levels of dis...",
l3-s2_984ac27f430a3730116ea1b3edb40d558af8d54a-weak-2,"Prior findings indicate pharmacy-directed interventions be necessary to ensure timely buprenorphine access for patients with opioid use disorder (Kazerouni et al., 2021).",Pharmacy-directed interventions be necessary to ensure timely buprenorphine access for patients with opioid use disorder.,weak,Pharmacy-directed interventions may be necessary to ensure timely buprenorphine access for patients with opioid use disorder.,...ependent pharmacies and those in Southern states. Pharmacy-directed interventions may be necessary to ensure timely buprenorphine access for patients with opioid use disorder.,
l3-s2_f6c0276011e76cce85600f4d9421fa08b9da65a8-sup-0,"Researchers reported that significant declines were observed in convenience store prevalence in lower- and medium-income and majority black tracts (p for trend: 0.004, 0.031, and 0.006 respectively), while a slight increase was observed in the prevalence of supermarkets in medium-income tracts (p for trend: 0.059) (Ohr","Significant declines were observed in convenience store prevalence in lower- and medium-income and majority black tracts (p for trend: 0.004, 0.031, and 0.006 respectively), while a slight increase wa",supported,"Significant declines were observed in convenience store prevalence in lower- and medium-income and majority black tracts (p for trend: 0.004, 0.031, and 0.006 respectively), while a slight increase was observed in the prevalence of supermarkets in medium-income tracts (p for trend: 0.059).","...e and race/ethnicity of the population each year. Significant declines were observed in convenience store prevalence in lower- and medium-income and majority black tracts (p for trend: 0.004, 0.031, and 0.006 respectively), while ...",
l3-s2_6896be60ec1981efa6dee8c1c81a8b35eb23edf7-nis-1,"Researchers reported that the intervention reduced five-year mortality by 60% in all subgroups (Dosa et al., 2020).",the intervention reduced five-year mortality by 60% in all subgroups,not_in_source,,"Warren Alpert School of Medicine, Brown University, Providence, RI b School of Public Health, Brown University, Providence, RI c Providence VAMC Center of Innovation (COIN), Provid...",
l3-oa_w4251751280-ins-4,"Researchers reported that these enhancements will improve the user experience, quality of results, and the pace of biological discovery (Tamura et al., 2021).","These enhancements will improve the user experience, quality of results, and the pace of biological discovery.",insufficient_evidence,,Methods for estimating divergence times and confidence intervals are implemented to use probability densities for calibration constraints for node-dating and sequence sampling date...,
l3-oa_w1979423827-con-1,"Prior findings indicate a workshop was held in Atlanta, Ga, in April 2796, to examine the reporting of meta-analyses of observational studies and to make recommendations to aid authors, reviewers, editors, and readers (Stroup, 2000).","A workshop was held in Atlanta, Ga, in April 2796, to examine the reporting of meta-analyses of observational studies and to make recommendations to aid authors, reviewers, editors, and readers.",contradicted,"A workshop was held in Atlanta, Ga, in April 1997, to examine the reporting of meta-analyses of observational studies and to make recommendations to aid authors, reviewers, editors, and readers.","...m, and they often evaluate observational studies. A workshop was held in Atlanta, Ga, in April 1997, to examine the reporting of meta-analyses of observational studies and to make recommendations to aid authors, reviewers, editors...",
l3-s2_484dea24f2a783ef06373aba97c9dd432e61fb3e-nis-3,"Prior findings indicate blockchain adoption cut administrative costs by half across hospitals (Kim, 2020).",blockchain adoption cut administrative costs by half across hospitals,not_in_source,,"Considering the increasing burden and serious consequences of frailty in aging populations, there is increasing interest in measuring frailty in health care databases for clinical ...",
l3-oa_w2036193982-nisthin-3,"lunar cycle phase significantly predicted weekly stock index returns (Austin, 2011).",lunar cycle phase significantly predicted weekly stock index returns,not_in_source,,The propensity score is the probability of treatment assignment conditional on observed baseline characteristics. The propensity score allows one to design and analyze an observati...,
l3-s2_e3da88f742d5d2f0f29e8f938e090061773fe633-sup-0,"The paper states that g., CO2 reduction, artificial photosynthesis, dye degradation) (Winter & Schubert, 2020).","g., CO2 reduction, artificial photosynthesis, dye degradation).",supported,"g., CO2 reduction, artificial photosynthesis, dye degradation).","...tions) as well as energy‐related applications (e. g., CO2 reduction, artificial photosynthesis, dye degradation). In this respect, not only homogeneous catalysts (i. e., molecular complexes) but also heterogeneous and recyclable o...",
l3-s2_2a3428653e76774140851a54d229c14d5e508146-con-1,"Researchers reported that for a mass vaccination campaign involving mass vaccination centres and communication of herd immunity benefits, our model predicted outright vaccine refusal in 41·4% (95% CI 28·6–30·2) of the French working-age population (Schwarzinger et al., 2021).","For a mass vaccination campaign involving mass vaccination centres and communication of herd immunity benefits, our model predicted outright vaccine refusal in 41·4% (95% CI 28·6–30·2) of the French w",contradicted,"For a mass vaccination campaign involving mass vaccination centres and communication of herd immunity benefits, our model predicted outright vaccine refusal in 29·4% (95% CI 28·6–30·2) of the French working-age population.","...-19 (had symptoms or knew someone with COVID-19). For a mass vaccination campaign involving mass vaccination centres and communication of herd immunity benefits, our model predicted outright vaccine refusal in 29·4% (95% CI 28·6–3...",
